{
    "items": [
        {
            "id": 1,
            "slug": "getting-started-with-bear-sunday",
            "title": "Getting Started with BEAR.Sunday",
            "excerpt": "Lorem ipsum dolor sit amet, consectetur adipiscing elit. Sed do eiusmod tempor incididunt ut labore et dolore magna aliqua. Ut enim ad minim",
            "status": "published",
            "publishedAt": "2026-01-01T10:07:00Z",
            "authorId": 1,
            "categoryId": 1
        },
        {
            "id": 2,
            "slug": "why-ray-mediaquery-changes-how-we-write-sql",
            "title": "Why Ray.MediaQuery Changes How We Write SQL",
            "excerpt": "In this article we walk through a concrete example: how we modeled a minimal CMS using BEAR.Sunday, and how the BDR pattern shaped the read ",
            "status": "published",
            "publishedAt": "2026-02-02T11:14:00Z",
            "authorId": 2,
            "categoryId": 2
        },
        {
            "id": 3,
            "slug": "a-deep-dive-into-alps-profiles",
            "title": "A Deep Dive into ALPS Profiles",
            "excerpt": "この記事ではBEAR.Sundayを用いた参照実装CMSを紹介します。BDRパターンにより読み込み側と書き込み側を分離し、保守しやすいコードベースを目指します。",
            "status": "published",
            "publishedAt": "2026-03-03T12:21:00Z",
            "authorId": 3,
            "categoryId": 3
        },
        {
            "id": 4,
            "slug": "hal-json-in-practice",
            "title": "HAL+JSON in Practice",
            "excerpt": "In this article we walk through a concrete example: how we modeled a minimal CMS using BEAR.Sunday, and how the BDR pattern shaped the read ",
            "status": "published",
            "publishedAt": "2026-04-04T13:28:00Z",
            "authorId": 4,
            "categoryId": 4
        },
        {
            "id": 5,
            "slug": "bdr-pattern-explained",
            "title": "BDR Pattern Explained",
            "excerpt": "When you treat your data as the source of truth about constraints (rather than choosing arbitrary limits up front), surprising things happen",
            "status": "published",
            "publishedAt": "2026-05-05T14:35:00Z",
            "authorId": 5,
            "categoryId": 5
        },
        {
            "id": 6,
            "slug": "migrating-from-phinx-to-doctrine-migrations",
            "title": "Migrating from Phinx to Doctrine Migrations",
            "excerpt": "この記事ではBEAR.Sundayを用いた参照実装CMSを紹介します。BDRパターンにより読み込み側と書き込み側を分離し、保守しやすいコードベースを目指します。",
            "status": "draft",
            "publishedAt": null,
            "authorId": 6,
            "categoryId": 6
        },
        {
            "id": 7,
            "slug": "testing-bear-resources-without-a-database",
            "title": "Testing BEAR Resources without a Database",
            "excerpt": "TL;DR included at the top.",
            "status": "published",
            "publishedAt": "2026-07-07T16:49:00Z",
            "authorId": 7,
            "categoryId": 7
        },
        {
            "id": 8,
            "slug": "the-hidden-power-of-php-attributes",
            "title": "The Hidden Power of PHP Attributes",
            "excerpt": "In this article we walk through a concrete example: how we modeled a minimal CMS using BEAR.Sunday, and how the BDR pattern shaped the read ",
            "status": "published",
            "publishedAt": "2026-08-08T09:56:00Z",
            "authorId": 8,
            "categoryId": 8
        },
        {
            "id": 9,
            "slug": "composing-modules-with-ray-di",
            "title": "Composing Modules with Ray.Di",
            "excerpt": "短いメモ。",
            "status": "published",
            "publishedAt": "2026-09-09T10:03:00Z",
            "authorId": 9,
            "categoryId": 9
        },
        {
            "id": 10,
            "slug": "from-crud-to-semantic-rest",
            "title": "From CRUD to Semantic REST",
            "excerpt": "When you treat your data as the source of truth about constraints (rather than choosing arbitrary limits up front), surprising things happen",
            "status": "published",
            "publishedAt": "2026-10-10T11:10:00Z",
            "authorId": 10,
            "categoryId": 10
        },
        {
            "id": 11,
            "slug": "bear-cms",
            "title": "BEAR.Cms アーキテクチャ概観",
            "excerpt": "In this article we walk through a concrete example: how we modeled a minimal CMS using BEAR.Sunday, and how the BDR pattern shaped the read ",
            "status": "published",
            "publishedAt": "2026-11-11T12:17:00Z",
            "authorId": 11,
            "categoryId": 11
        },
        {
            "id": 12,
            "slug": "alps",
            "title": "ALPSで設計を共有する",
            "excerpt": "ALPSプロファイルをまず書き、Fakeデータを生成してから制約を発見するというアプローチは、現実のデータに裏打ちされたスキーマを生むという意味で大きな利点があります。",
            "status": "draft",
            "publishedAt": null,
            "authorId": 12,
            "categoryId": 12
        },
        {
            "id": 13,
            "slug": "fake",
            "title": "Fakeデータから制約を発見する",
            "excerpt": "Lorem ipsum dolor sit amet, consectetur adipiscing elit. Sed do eiusmod tempor incididunt ut labore et dolore magna aliqua. Ut enim ad minim",
            "status": "published",
            "publishedAt": "2026-01-13T14:31:00Z",
            "authorId": 13,
            "categoryId": 13
        },
        {
            "id": 14,
            "slug": "ray-mediaquery-bdr",
            "title": "Ray.MediaQueryのBDR実装例",
            "excerpt": "A brief note.",
            "status": "published",
            "publishedAt": "2026-02-14T15:38:00Z",
            "authorId": 14,
            "categoryId": 14
        },
        {
            "id": 15,
            "slug": "cms",
            "title": "小さなCMSの育て方",
            "excerpt": "短いメモ。",
            "status": "published",
            "publishedAt": "2026-03-15T16:45:00Z",
            "authorId": 15,
            "categoryId": 15
        },
        {
            "id": 16,
            "slug": "semantic-ex-method-an-introduction",
            "title": "Semantic-Ex Method: An Introduction",
            "excerpt": "Lorem ipsum dolor sit amet, consectetur adipiscing elit. Sed do eiusmod tempor incididunt ut labore et dolore magna aliqua. Ut enim ad minim",
            "status": "published",
            "publishedAt": "2026-04-16T09:52:00Z",
            "authorId": 16,
            "categoryId": 16
        },
        {
            "id": 17,
            "slug": "building-a-reference-cms-for-bear-sunday",
            "title": "Building a Reference CMS for BEAR.Sunday",
            "excerpt": "In this article we walk through a concrete example: how we modeled a minimal CMS using BEAR.Sunday, and how the BDR pattern shaped the read ",
            "status": "published",
            "publishedAt": "2026-05-17T10:59:00Z",
            "authorId": 17,
            "categoryId": 17
        },
        {
            "id": 18,
            "slug": "content-modeling-articles-categories-tags",
            "title": "Content Modeling: Articles, Categories, Tags",
            "excerpt": "短いメモ。",
            "status": "draft",
            "publishedAt": null,
            "authorId": 18,
            "categoryId": 18
        },
        {
            "id": 19,
            "slug": "why-we-dropped-js-from-our-admin",
            "title": "Why We Dropped JS from Our Admin",
            "excerpt": "When you treat your data as the source of truth about constraints (rather than choosing arbitrary limits up front), surprising things happen",
            "status": "published",
            "publishedAt": "2026-07-19T12:13:00Z",
            "authorId": 19,
            "categoryId": 19
        },
        {
            "id": 20,
            "slug": "hal-links-and-embedded-resources",
            "title": "HAL Links and Embedded Resources",
            "excerpt": "When you treat your data as the source of truth about constraints (rather than choosing arbitrary limits up front), surprising things happen",
            "status": "published",
            "publishedAt": "2026-08-20T13:20:00Z",
            "authorId": 20,
            "categoryId": 20
        }
    ],
    "page": 1,
    "perPage": 20,
    "totalCount": 50
}
